Nombre	Descripcion	Latitud	Longitud	Tipo	Clase_vial	Nombre_vial	Numero_vial	Codigo_postal
Café Angélica (calle San Bernardo)	Los amantes del café pueden disfrutar de las mejores variedades en este pequeño y acogedor local, ubicado en la que un día fue la primera tienda de especias de Madrid. El cliente puede comprar también hierbas naturales, especias raras, frutos secos, cafés y tés, así como probar ensaladas, tostas y bocadillos, elaborados con productos ecológicos y de primera calidad.El grupo Deluz es el encargado de dirigir esta cafetería que sirve café de pequeños productores de Etiopía, Ruanda, Tanzania, El Salvador, Colombia, Guatemala y Brasil. En ella se tuesta en una Probat alemana (la mejor tostadora del mercado), ofreciendo el café que más gusta a los muy cafeteros. Además, el negocio colabora con un proyecto de cooperación en Costa de Marfil.En Café Angélica también se puede desayunar una tostada de queso fresco eco pasiego, comer un bocadillo de roast beef de Cantabria con mostaza violeta, una ensalada de pechuga de pollo eco de Segovia o tomar un tomate gigante con hierbas y especias, entre otras propuestas.	40.423237700000	-3.707365700000	Clubs	Calle	de San Bernardo	 24	28015
Sala Nazca Live	En pleno centro financiero de Madrid se encuentra este espacio para conciertos, un recinto que busca convertirse en una de las salas clave de música en directo de la ciudad.Cuenta con un aforo para 500 personas, una buena conexión en transporte público y un parking cercano para facilitar la llegada de asistentes y artistas.A través de su web oficial se puede consultar la agenda mensual de conciertos y acceder a la venta online de entradas.	40.451460800000	-3.694816800000	Clubs	Calle	Orense	 24	28020
Los Artesanos 1902. Chocolatería y churrería 	Esta churrería es creación de Don Gabi, la cuarta generación de una familia de churreros que lleva ofreciendo churros y chocolate desde hace más de 100 años. Su producto destaca por la calidad de la materia prima y por una elaboración artesanal.El local, situado en pleno barrio de Sol, muy cerca de la Plaza de las Descalzas, está dividido en dos plantas, con tres espacios diferenciados. En él se puede disfrutar de desayunos, meriendas , comidas y cenas, en las que poder degustar carnes del Bierzo, pescados frescos y postres caseros.Entre los productos más famosos se encuentran, además de los chocolates con churros, los pestiños o las torres de flores o floreta (de chocolate, miel o azúcar con canela). El chocolate está elaborado con 3 cacaos suramericanos.	40.417539400000	-3.706879500000	Clubs	Calle	de San Martín	 2	28013
Almonte Sala Rociera	LA SALA CERRÓ A MEDIADOS DE DICIEMBRE DE 2020 COMO CONSECUENCIA DE LA PANDEMIA POR CORONAVIRUS.El distrito de Salamanca cuenta con el local de referencia en Madrid para disfrutar de las sevillanas y del ambiente andaluz. Almonte ofrece lo mejor de la cultura y tradición andaluza, con actuaciones en directo de los más destacados grupos y cantantes del género así como una deliciosa cocina tradicional.Almonte Sala Rociera abrió sus puertas en 1987 en Madrid, en pleno boom de las sevillanas por toda España. Desde 1998 se especializó en ofrecer actuaciones de los más grandes artistas de las sevillanas del país. Hoy, se sitúa como un referente de las sevillanas, ampliamente conocido por los turistas que quieren sumergirse en la cultura española en su paso por la ciudad.La arquitectura de la sala transmite la tradición andaluza con elementos de todos los rincones del sur: la fachada cordobesa, los bellos azulejos sevillanos y la sillería onubense. Desde la entrada hasta la salida los visitantes se introducen de lleno en la cultura andaluza, donde la fiesta se respira por los cuatro costados. 	40.432766300000	-3.678741300000	Clubs	Calle	de Juan Bravo	 35	28006
Medias Puri 	CERRADO HASTA NUEVO AVISO COMO MEDIDA DE PREVENCIÓN EN LA LUCHA CONTRA EL CORONAVIRUS.Medias Puri participa en el espacio al aire libre Abre Madrid, en Feria de Madrid - Ifema, viernes y sábados desde el 17 de julio, junto a Uñas Chung Lee y Tacones Manoli.Bajo la apariencia de una típica mercería de barrio se esconde, como si fuera un club clandestino, la discoteca Medias Puri, que ofrece una de las ofertas de ocio más espectaculares de la noche madrileña, compuesta de cócteles, espectáculos, gastronomía y mucha diversión. Con una capacidad para 1.000 personas, el local, que se encuentra situado en los bajos del Teatro Nuevo Apolo, cuenta con tres pistas de baile: la Sala Central, con espectáculos en vivo ( transgresoras actuaciones que trasladan al espectador a los infiernos de Dante), música electrónica, dance y Rock & Roll; la Sala Negra, con música disco de la década de 1980; y el Apotheke, una sala con muchas sorpresas.Medias Puri-The Secret surge de la mano de LETSGO, la productora de la saga THE HOLE. 	40.412347800000	-3.703341900000	Clubs	Calle	de Tirso de Molina	 1	28012
Barbara Ann	Situado en la zona de las Salesas, se encuentra este espacio acogedor donde refugiarse para saborear cocktails deliciosos, degustar exquisitos platos o simplemente tomar una cerveza con los amigos después del trabajo, mientras se disfruta de los mejores clásicos de música rock y pop.Elías Fernández da vida a una carta de cócteles que además de los grandes clásicos, ofrece una serie de combinados originales que cambian cada tres meses. Pepe Rocho es el reponsable de una breve pero variada carta que incluye especialidades como el salmorejo con helado de jamón, infusión de albahaca fresca y grissinis, el sashimi de salmón con alga wakame y helado de wasabi o los tacos de cochinita pibil con guacamole.	40.425719500000	-3.695814100000	Clubs	Calle	Santa Teresa	 8	28004
Garra Bar	En la planta baja del hotel Barceló Torre de Madrid se encuentra este &#39;cocktail bar’ donde huéspedes y demás clientes pueden disfrutar de una gran oferta coctelera.Este bar elegante y de aires neoyorquinos, diseñado por el prestigioso interiorista Jaime Hayón, es el lugar perfecto para tomar una copa o un cóctel antes en pleno corazón de la noche madrileña, a dos pasos del ‘Broadway madrileño’. Un botellero retroiluminado de seis metros de altura preside este local que, entre lámparas y sofás de diseño, cuenta con una oferta centrada en copas, cócteles y zumos, y una programación que jueves, viernes y sábados incluye conciertos de jazz, música en directo y sesiones de dj. En la segunda planta del hotel, se encuentra el restaurante Somos, un lugar ideal para disfrutar de la mejor cocina mediterránea.	40.424369600000	-3.712326200000	Clubs	Calle	de España	 18	28008
El Perla	Este bar, situado en la zona de La Latina conocida como Little Chueca, es un animado local muy popular donde disfrutar de unas cañas y unas tapas.Al igual que en otros locales del barrio, el domingo es el día más concurrido de este local, dada su cercanía a la zona del Rastro. Ofrece sabrosas tapas y raciones a primera hora y copas con música de baile al caer la tarde. 	40.409326600000	-3.711608600000	Clubs	Calle	Calatrava	 14	28005
Sixta Bar	Situado en la zona popularmente conocida como Little Chueca, en los alrededores de las calles Paloma y Calatrava, se encuentra este bar de copas que, sin ser de ambiente, sí que cuenta con un público mayoritariamente gay, al que se suman muchos vecinos del barrio y todo tipo de clientela.La Sixta es un local con una decoración entre kitsch y cañí donde se mezclan música pop actual y grandes éxitos de siempre. Al igual otros locales del barrio como El Atril y La Perla, la tarde de los domingos es su &#39;día grande&#39;, con copas a buen precio, ambiente de baile y mucha diversión.	40.409190964141	-3.711391389370	Clubs	Calle	Calatrava	 15	28005
El atril copas	Situado en el barrio de La Latina se encuentra este local de ambiente gay cuyas puertas llevan abiertas desde 1983. Aunque es uno de los imprescindibles de las noches del barrio, su día grande es el domingo, cuando el local permanece abierto desde la tarde hasta altas horas de la madrugada, dejando así amplio margen para disfrutar de unas copas y bailar música pop en un ambiente siempre divertido.	40.408839683147	-3.711705207825	Clubs	Calle	de la Paloma	 9	28005
Gymage Lounge	Situado en la azotea de los antiguos Cines Luna, el Gymage Lounge Resort es una animada terraza-solarium ideal para relajarse, probar el menú del día o tomar un cóctel mientras se disfruta de una maravillosa vista de la ciudad.El Gymage Lounge Resort es un espacio que se adapta a todas las épocas del año gracias a una acogedora zona interior y una concurrida terraza con múltiples sofás, camas, butacones y hamacas. En ambas se puede degustar de la cocina del restaurante del local, que ofrece una carta donde encontramos platos informales que van desde el hummus hasta las hamburguesas, pasando por pastas, carpaccios y tartares.	40.421363700000	-3.704813200000	Clubs	Calle	de la Luna	 2	28004
welKHOME Club	Situado en el barrio de Chamberí, a pocos metros de la Plaza de Colón, se encuentra este club social que aúna el desarrollo empresarial con el ocio en un lugar amplio e informal donde el cliente puede servirse una copa él mismo y pagar al peso por lo consumido.Este establecimiento, un lugar que ofrece un ambiente especialmente diseñado para man­tener reuniones de trabajo y organizar todo tipo de eventos privados, cuenta con la peculiaridad de disponer, casi en exclusiva, de alcohol nacional, desde ginebra de Madrid hasta ron de Granada, que se puede acompañar de un surtido buffet de snacks, especias y frutas. 	40.427383587058	-3.692291378975	Clubs	Calle	del Monte Esquinza	 15	28010
Madrid 1883 Churrería - Chocolatería	Situada en el barrio de Malasaña se encuentra la churrería más antigua de Madrid, donde se puede disfrutar de un tradicional chocolate con churros mientras se observa su proceso de elaboración a través de su cocina vista. Churreria 1883 es un local acogedor, con un ambiente que combina lo antiguo y lo moderno gracias a detalles como su falso lucernario, lámparas de hierro y una gran ventana hacia la cocina y su máquina de chocolate. En una zona de mesas altas con taburetes se sirven desayunos y meriendas que incluyen barritas con tomate y aceite o con jamón, cruasanes, sándwiches, tostadas con mantequilla y mermelada o Nutella, napolitanas o gofres, entre otras deliciosas opciones.	40.425191400000	-3.702657700000	Clubs	Calle	del Espíritu Santo	 8	28004
Café Pavón	En la parte alta de Embajadores se encuentra la antigua cafetería del Teatro Pavón, un café de barrio con barra de zinc, mesas y sillas de madera, grandes ventanales y un techo de madera art decó de 1924 que apareció durante las obras de reforma. Su carta, sencilla pero sabrosa, ofrece &#39;cañas&#39;, café de calidad y propuestas gastronómicas tradicionales como la ensaladilla rusa, hamburguesas o tortilla de patata.	40.410102700000	-3.706196300000	Clubs	Calle	de Embajadores	 9	28012
La Violeta	Luis y Manuel forman parte de la cuarta generación de propietarios de esta castiza taberna del barrio de Chamberí que ha abierto de nuevo sus puertas convertida en una vermutería. Sirven hasta 20 tipos diferentes de vermú, que se pueden degustar acompañados de tapas de lo más clásicas, como los boquerones en vinagre o las anchoas ahumadas.	40.436813879215	-3.708314895630	Clubs	Calle	de Vallehermoso	 60	28015
Pum Pum Café	Este café está situado en el barrio de Lavapiés, muy cerca de esos grandes contenedores culturales que son Tabacalera y La Casa Encendida. Con paredes de ladrillo visto, pizarras con mensajes y antiguos muebles, Pum Pum Café ofrece precisamente eso: café de calidad. Y, además, ecológico, algo que encaja con el resto de la carta del local, un auténtico templo para vegetarianos y veganos. 	40.408071500000	-3.701973500000	Clubs	Calle	del Tribulete	 6	28012
Salmón Gurú	"El barman argentino Diego Cabrera tiene en pleno centro de Madrid esta coctelería que ofrece distintos y sorprendentes ambientes y novedosas propuestas mixológicas. Se encuentra, además, en la lista The world&#39;s 50 best bars 2018 (los mejores bares del mundo), ocupando el puesto 19, lo que la convierte en la mejor coctelería de España.El primero de los espacios de Salmón Guru es la propia entrada, concebida como una antigua licorería repleta de botellas antiguas originales, con una zona de barra inspirada en un club neoyorquino de los años 60 de bancadas corridas, terciopelos y estampados florales. Sin embargo, la zona más especial del local es la ""mesa del barman"", un espacio de coctelería de autor con una estética rompedora donde destaca un gran luminoso de Schweppes e ilustraciones hechas a mano sobre sus paredes por el joven artista gráfico Joaquín Rodríguez. Funciona, previa reserva, a modo de mesa del barman, atendida y oficiada por el propio Diego, que actua como anfitrión y maestro de ceremonias recomendándoles según sus apetencias o estado de ánimo y creando nuevas y sorprendentes mezclas en vivo.Una última sala ofrece al comensal un espacio íntimo con mesas en boxes y una decoración inspirada en el comic, también con dibujos originales de Joaquín Rodríguez, pero esta vez basados en elementos propios de manga como el sol naciente, osos pandas, peces koi o un kamikaze japonés.Para acompañar a sus cócteles, Salmón Guru presenta también una carta con varios platos para compartir, que destacan por su originalidad y cuidada presentación."	40.414921486977	-3.699525296688	Clubs	Calle	de Echegaray	 21	28014
Sala Olvido	Situada en el sur de Madrid, en el distrito de Usera, la Sala Olvido ofrece buen ambiente con la mejor música comercial del momento. Durante todo el fin de semana se realizan fiestas temáticas con animación especial y conciertos de música en directo. Además, se dan clases de salsa y bachata.	40.386762488518	-3.702768087387	Clubs	Calle	Olvido	 15	28026
La Bombilla Piano-Bar	Este piano bar ofrece noches especiales en un ambiente íntimo pero animado donde disfrutar de música en directo mientras se toma una copa o un cóctel. Situado en la zona de Chamartín, muy cerca del Paseo de la Castellana, cuenta con una amplísima y variada programación de conciertos de diferentes estilos, con bandas y cantautores nacionales y extranjeros.	40.461491000000	-3.688036900000	Clubs	Calle	Carlos Maurras 4	0	28036
Tablao Flamenco La Estación de los Porches	Situado en la zona de Entrevías (Puente de Vallecas), este restaurante-asador cuenta con grandes artistas de la escena del flamenco en Madrid sobre su escenario. Cada actuación se convierte en una experiencia única e inolvidable gracias al talento y la calidad de sus espectáculos. Baile, cante y música en directo se dan la mano en tres escenarios, cada uno con su ambiente y show correspondiente.Además, mientras se disfruta del espectáculo de flamenco, se puede degustar una amplia selección de platos y tapas especiales de su restaurante asador. El local se encuentra en una zona de profundas raíces flamencas, cuna de grandes artistas del género, y cuya esencia queda reflejada en el ambiente y la decoración del tablao.	40.387888175690	-3.672274053097	Clubs	Calle	Timoteo Pérez Rubio	 2	28053
Cereal Hunters Café	En este local, situado en la zona de Salesas, los protagonistas absolutos son los cereales, que se pueden consumir en cualquier momento del día, acompañados de una amplia variedad de leches y toppings.Se trata de la primera cafetería de cereales que abre en nuestro país, cuyo objetivo es que la gente pueda desayunar como en su casa. Cuentan con 160 tipos de cereales, tanto nacionales como internacionales y más de 20 tipos diferentes de leches animales y vegetales, para tomar en el local o para llevar, además de una gran variedad de toppings, desde mini-galletitas a fruta fresca pasando por marshmallows, M&M’S o Filipinos.La cadena cuenta con otras cafeterías en las calles Conde de Miranda, 4, Reina, 1 y Alcalá, 90.	40.427316208487	-3.698841333389	Clubs	Calle	de Mejía Lequerica	 14 	28004
Karaoke Duarciñan	El karaoke Duarciñan, situado en la zona de Madrid Río, es un pub de trato familiar que lleva más de diez años en funcionamiento y en el que además se pueden celebrar todo tipo de eventos y fiestas privadas. Cuenta con más de 30.000 canciones que se van actualizando periodicamente.	40.406518000000	-3.719770700000	Clubs	Calle	Paradinas	 1	28005
La terraza de la Reina	Muy cerca de la Gran Vía se encuentra esta terraza situada en la Plaza de Pedro Zerolo, en la que se puede disfrutar a cualquier hora del día de una variada oferta gastronómica, para poder desde picotear a comer platos caseros de carta. podrás desayunar, comer de menú y a la carta, merendar, picotear algo y beber a cualquier hora del día.Abierta durante todo el año, la Terraza de la Reina ofrece desayunos, menú de mediodía entre semana, tapas, sandwiches, hamburguesas, pizzas y cócteles, entre otras opciones. Cada 6 meses cambia de aspecto para adaptar la terraza a la climatología. 	40.421012000000	-3.699498400000	Clubs	Calle	de Pedro Zerolo	 s/n	28004
Sala Silikona	Esta sala, situada en el barrio de Moratalaz, fundada en 1985, cuenta con miles de conciertos a sus espaldas. Se trata de un referente en el panorama musical madrileño, apostando por lo popular y por las nuevas bandas.La Sala Silikona abre todos los días y tiene una cuidada programación de conciertos con una media de entre 3 y 4 actuaciones de música en vivo por semana. Por su escenario han pasado grandes grupos y solistas como Antonio Vega, Enrique Urquijo, Luz Casal, Los Rodriguez, Amaral, Dover o Los Planetas.	40.405825126686	-3.652310371399	Clubs	Calle	del Encuentro	 1	28030
Café del Río	Este agradable restaurante y café, situado en el entorno natural del Río Manzanares (Madrid Río), dispone de una amplia terraza desde la que disfrutar de unas impresionantes vistas al Palacio de Oriente, la catedral de La Almudena y la basílica de San Francisco El Grande. El local se divide en tres espacios: el salón interior, la terraza exterior y un mirador situado en la planta superior. En Café del Río se puede tomar desde un asequible menú del día a diario, pasando por raciones y tostas y platos caseros que combinan la cocina tradicional con otras propuestas más modernas. También dispone de una amplia carta de cócteles y gin tonics. 	40.416959523924	-3.723249435425	Clubs	Calle	de Portugal	 1	28011
El jardín secreto	De cuidada decoración llena de detalles, este café es ya un clásico de la zona de Conde Duque, especialmente a la hora de disfrutar de una de sus suculentas meriendas o tomar una copa al llegar la noche.El Jardín Secreto es un local lleno de encanto y pequeños detalles que adornan cada mesa y le dan a cada rincón un ambiente diferente. En su carta destacan multitud de cafés del mundo, infusiones, batidos naturales y chocolates de todas las clases, desde chocolate con pétalos de rosa hasta chocolate con helado de violetas. Los más golosos pueden disfrutar también de una gran variedad de tartas.Por otro lado, cuando cae la noche este establecimiento se convierte en un restaurante donde se puede picar algo y terminar la velada con uno de sus variados cócteles.	40.425779400000	-3.711512800000	Clubs	Calle	del Conde Duque	 2	28015
El Tren	Este conocido pub de Argüelles es punto de encuentro de muchos amantes de los juegos de mesa, ya que cuenta con una gran colección de ellos puesta a disposición de sus clientes, para que disfruten de una animada partida entre amigos mientras toman un café o uno de sus variados cócteles.Situado en las inmediaciones del metro de Islas Filipinas se encuentra este popular bar donde es frecuente encontrar animados grupos que disfrutan de una partida de Monopoli, Trivial, ajedrez, damas…. Su decoración, dedicada enteramente a los trenes, dan un ambiente simpático y acogedor a este local a medio camino entre bar y cafetería, donde se puede tomar tanto un buen café como un cóctel, con o sin alcohol.	40.435464300000	-3.711532500000	Clubs	Calle	de Blasco de Garay	 47	28015
La Bicicleta	Este espacio, situado en el corazón del barrio de Malasaña, nace de la pasión por las bicis, el arte y el café a partes iguales. Se trata de un local acogedor y con personalidad, con un cuidado esmerado por el café, la repostería artesanal y la comida sana. El propósito de La Bicicleta es llegar a ser un lugar de encuentro para los aficionados y amantes de la bici, donde ellos mismos puedan inflar sus ruedas, arreglar un pinchazo o usar las herramientas del banco de trabajo. Además, en sus estanterías también se pueden encontrar publicaciones y libros especializados sobre bicicletas, así como asistir a charlas y eventos  relacionados con este ecológico medio de transporte. La Bicicleta cuenta con otras dos sucursales: La Bicicleta Concha Espina en la Plaza de Cataluña, 2, y La Bicicleta Galileo en la calle Galileo, 39.	40.423820597330	-3.702242374420	Clubs	Calle	de San Ildefonso	 9	28004
Fábrica Maravillas	Situada en pleno barrio de Malasaña se encuentra esta mini-fábrica que elabora y embotella su propia cerveza artesanal, todo un lujo para los paladares más exquisitos.La Fábrica Maravillas es un local pequeño que tiene a la vista de todos, e integradas en su interiorismo de corte industrial, las instalaciones donde fabrica su cerveza. El punto fuerte de este bar está en sus seis tipos de cerveza, con las que pretende llegar a todo tipo de público, desde el más entendido en la materia, para el que ofrecen cervezas tipo Saison, Pale Ale o Stout, hasta los que prefieren su versión más convencional, para quienes recomiendan la Malasaña Ale, una rubia inspirada en el barrio, ligera y de baja fermentación.	40.422658100000	-3.701735500000	Clubs	Calle	de Valverde	 29	28004
1862 Dry Bar	Ubicada en Malasaña, uno de los barrios de Madrid con más ambiente nocturno, se encuentra esta coctelería que rinde homenaje a la mixología clásica y que recupera recetas y técnicas originales. El nombre de esta coctelería recuerda el año en que se publicó el primer libro de cócteles de la historia, ‘The Bon Vivant’s Companion or How to mix drinks’, de Jerry Thomas, del cual proceden parte de las 30 fórmulas que figuran en su carta.Algunos de sus cócteles más famosos son el Mint Julep, una especie de mojito preparado con bourbon, sirope de azúcar y menta, servido en un vaso de metal, el Gin Fizz, con ginebra, sirope de azúcar, zumo de limón y huevo, o el Martínez, con vermouth dulce, ginebra, licor de Maraschino y angostura.	40.424138000000	-3.706506100000	Clubs	Calle	del Pez	 27	28004
La Villana Gin & Cocktail Room	Esta coctelería, situada en la zona de Cuzco, a pocos metros del paseo de la Castellana, cuenta con una original carta de bebidas que, a modo de tabla periódica, muestra las diferentes combinaciones de sus 33 ginebras con sus 11 tónicas.La Villana es un establecimiento elegante y cálido, con una decoración industrial a la vez que clásica en sus altas butacas y sofás de cuero, que invita a relajarse después de una jornada de trabajo. Entre su oferta de destilados premium encontramos el selecto Vodka Svedka, el delicioso Ron Cartavio o el Pisco Peruano Demonio de los Andes, entre otros. 	40.460890953370	-3.685601949692	Clubs	Calle	de Padre Damián	 37	28036
Harveys	Harvey&#39;s es una original coctelería inspirada en el elegante Hollywood de los años 40, donde la coctelería clásica, la de autor y los combinados premium eran tan característicos de la época.En la carta de Harvey&#39;s se pueden encontrar más de 60 cócteles y una cocina casera americana en la que destaca el solomillo de Morucha, una de las carnes más prestigiosas de nuestro país, los tomates verdes fritos y una gran variedad de hamburguesas. 	40.424766500000	-3.700638800000	Clubs	Calle	de Fuencarral	 70	28004
La Coquette	Este local, situado a escasos metros del Teatro Real de Madrid, es uno de los últimos templos de Blues en la ciudad, con actuaciones en directo todas las semanas. Se trata de un pequeño bar subterráneo, una de esas cuevas de ladrillo tan típicas de las ciudad, con un ambiente acogedor donde el espectáculo está garantizado gracias a magnificas improvisaciones y solos. Entre los instrumentos que escucharás no faltarán la batería, bajo, guitarra, armónica, teclados e incluso instrumentos exóticos de bandas étnicas o africanas.	40.417594600000	-3.707599700000	Clubs	Calle	de las Hileras	 14	28013
Maestro Churrero. Chocolatería & Churrería 	Chocolatería - churrería con más de 110 años de historia que se encuentra en el corazón del barrio de las letras de Madrid. Un espacio único, que apuesta por la innovación en este producto estrella de la repostería española.Un sin fin de propuestas creativas, donde hay 3 protagonistas principales, el churro, la porra y el chocolate. Churros mch, maki- churros, cocktails de chocolate, churros con helado de chocolate, churros golosos, 7 colors, o bien el tradicional chocolate con porras, todo un despliegue de sabores con los mejores productos del mercado.	40.414200603419	-3.703248202801	Clubs	Calle	de Jacinto Benavente	 2	28012
Jazzville Café	Próximo al parque de El Retiro se encuentra este local de música en directo en el que se puede disfrutar de la mejor música jazz así como de monólogos, en un entorno que recuerda a los clubes neoyorquinos.	40.409633100000	-3.671019600000	Clubs	Calle	de Jesús Aprendiz	 19	28007
