Nombre	Descripcion	Latitud	Longitud	Tipo	Clase_vial	Nombre_vial	Numero_vial	Codigo_postal
Kialma Cocktails and Drinks	En plena zona de Campo de las Naciones, repleta de oficinas y situada junto a Feria de Madrid, este local resulta una muy buena opción para practicar el afterwork.En un espacio acogedor y un ambiente relajado que en verano se extiende a su elegante terraza, Kialma nos ofrece una amplia carta de cócteles con más de cien variedades, entre las que se encuentran algunos ejemplos de coctelería molecular, especialidad por la que se consiguen texturas especiales mediante el uso de técnicas de manipulación química. Además, destacan sus numerosas marcas premium, entre ellas 40 referencias diferentes de ginebras.	40.456451000000	-3.619254700000	Clubs	Calle	de los Andes	 25	28043
Il Morto Che Parla	Local de copas ecléctico e informal en un barrio con las mismas características como es Lavapiés. Sin embargo, el perfil de este bar es algo más sibarita, como muestra una carta de bebidas elaboradas entre las que se encuentran &#39;gin-tonics&#39; de diferentes marcas selectas o cócteles varios como el &#39;aperol spritz&#39;.También cuenta con comida para picar algo rápido a cualquier hora del día, como pizzas al horno, piadinas y empanadas chilenas. En cuanto a la propuesta musical, encontramos desde bossa nova y jazz hasta funky, soul o salsa.	40.408933630569	-3.699109554291	Clubs	Calle	Salitre 	 31	28012
Beer Station	Con una decoración inspirada en una antigua estación de tren, esta cervecería internacional es famosa por el ambiente acogedor y su extensa carta de cervezas, que pueden tomarse acompañadas de hamburguesas caseras, perritos calientes, ensaladas o numerosos platos de comida centroeuropea para compartir, además de postres, cafés, batidos, etc. Uno de los elementos distintivos de este local, muy próximo a la Gran vía, son sus actuaciones en directo, que incluyen conciertos, monólogos (también en inglés, con cómicos nativos) y representaciones teatrales diversas.	40.419687701198	-3.708481192589	Clubs	Calle	de Santo Domingo	 22	28013
Terraza Playa	Junto al espectacular Puente Monumental de Arganzuela, diseñado por Dominique Perrault, se encuentra este quiosco de restauración. Situado al lado de la playa urbana, de la que gestiona su servicio de tumbonas, cuenta con una amplia terraza con varias mesas y sombrillas donde se sirven desde bocadillos a ensaladas, helados, pizzas, tapas y similares, así como todo tipo de bebidas. 	40.396009045783	-3.704809248447	Clubs	Calle	de Yeserías	 33	28004
Jorge Juan 92	Jorge Juan 92 es uno de los &#39;gin club&#39; madrileños que hacen gala del &#39;perfect serve&#39;, es decir, la forma idónea de servir el gin-tonic.Más de 92 marcas de ginebra, junto con rones y whiskys &#39;premium&#39; comparten carta con las mejores tónicas del mercado en este local de decoración minimalista y moderna, ideal para tomar una copa de calidad el fin de semana o al salir del trabajo.	40.423203946139	-3.673869967461	Clubs	Calle	de Jorge Juan	 92	28009
Klimt Gin Club & Premium Bar	Klimt es un local de copas de decoración suntuosa a la vez que moderna. Paredes con papeles de arabescos, taburetes dorados y una iluminación en los mismos tonos dan un ambiente muy especial a este ‘afterwork’ en el que relajarse.Con sus 150 referencias de ginebra premium, 40 tipos de rones Premium, o con su amplia carta de vodkas y whiskys, este local concurrido por ejecutivos se anima a medida que avanza la noche.	40.461556800000	-3.691730700000	Clubs	Calle	del Poeta Joan Maragall	 48	28020
Las Cuevas de Sandó	Este local, que forma parte del Hotel Santo Domingo, se encuentra enclavado en unas cuevas originales del siglo XVI que eran parte de un edificio ocupado por la inquisición. En la actualidad han sido recuperadas como coctelería en un ambiente urbano, cosmopolita y chic.Lo primero que llama la atención es su decoración, en la que destaca su suelo de cristal que cambia de colores por efecto de la fibra óptica y que convierte este local en un lugar único en Madrid. El coctel estrella aquí es el mojito de pétalos de flores. La carta, que incluye también comida como hamburguesas, sandwiches o ensaladas. está compuesta por más de 17 marcas de ginebra premium. Dan mucha importancia a la música para que el ambiente invite a la conversación tranquila los fines de semana o después del trabajo. En general es tipo chill out pero también se escucha jazz o los ritmos de un DJ que pincha en vivo.	40.420617829163	-3.708781599999	Clubs	Calle	de Santo Domingo	 13	28013
Gorila	Gorila es un moderno bar de Malasaña pensado para tomar unas cañas y acompañarlo de tapas y tostas, que además funciona como coctelería.El local tiene una decoración de estilo industrial y con claras referencias al street art. En él se organizan exposiciones, workshops y concursos de fotografíalo convierten en el lugar perfecto para empezar la noche, en un entorno distentido e informal que invita a conversar. Además, tiene una pequeña terraza exterior.	40.423281538321	-3.702821731567	Clubs	Calle	Corredera Baja de San Pablo	 47	28004
Terraza Matadero	Durante los meses de verano se puede disfrutar de la terraza-bar en la Plaza Matadero, el patio abierto de Matadero Madrid, situado entre los diversos edificios que conforman este gran espacio cultural. Cada verano la terraza está acompañada por alguna actividad o instalación artística, música y todos los protagonistas de la temporada​Se trata de un sistema modular y móvil de islas vegetales, espacios verdes donde jugar, tumbarse a descansar y tomar unas cervezas a la sombra. Una terraza-bar para disfrutar de las noches del verano madrileño.	40.392503900000	-3.697232600000	Clubs	Calle	de la Chopera (Plaza Matadero. Matadero Madrid)	 14	28045
La Chula de Valverde	Este bar ofrece un ambiente relajado y acogedor donde tomar una copa. Se trata de un espacio diáfano en el cual se mezclan los sofás chester con los bancos de madera, el ladrillo visto, las sillas del Rastro y lámparas de los sesenta.Es una mezcla entre el diseño sofisticado y el casticismo madrileño de toda la vida. La especialidad es el gin-tonic, del que ofrecen hasta doce combinaciones distintas. De su oferta de tentempiés destaca la empanada gallega de diferentes rellenos.	40.421221231317	-3.702148497105	Clubs	Calle	de Valverde	 11	28004
Gayarre	Gayarre ofrece un ambiente clásico y elegante para los momentos de ocio nocturno.Es el local perfecto para tomar una copa cómodamente en sus diversos salones o en una de las cuatro barras. Cuando Madrid cierra sus ojos, Gayarre nos abre sus puertas.	40.448241155149	-3.690376281738	Clubs	Calle	de la Castellana	 118	28046
Casa Pueblo	Antes de ser uno de los lugares de moda en el Barrio de las Letras, era un viejo café literario de la zona. Tras ser reformado, el local sigue conservando su encanto y ofreciendo cafés, copas, buena comida y una variada programación cultural que incluye exposiciones y actuaciones musicales.Cuenta con una decoración que recuerda a la de los cafés clásicos de Europa y con una carta de cócteles y de tés exquisitos y elaborados con ingredientes naturales. Para comer cuentan con varias raciones, tostas y dulces.	40.414618300000	-3.698584500000	Clubs	Calle	del León	 3	28014
La Inquilina	Espacio Cultural situado en el corazón de Lavapiés donde además de tomar una cervezas y picar algo, se pueden visitar exposiciones de artistas emergentes, asistir a talleres creativos o eventos literarios. 	40.409638232054	-3.700890541077	Clubs	Calle	del Ave María	 39	28012
El Estocolmo	Este local es uno de los bares míticos del barrio de Malasaña, famoso por sus deliciosos perritos calientes. Se trata de un espacio pequeñito y recogido, con una estética retro y un ambiente muy cosmopolita donde se puede disfrutar de una cerveza o un cocktail mientras escuchas la mejor música chill-out, rock e indie.	40.426862932712	-3.708768188953	Clubs	Calle	de la Palma	 72	28015
Chocolatería de San Ginés	Situada en el Pasadizo de San Ginés, a pocos metros de la Puerta del Sol, se encuentra esta chocolatería, considerada la más famosa de la ciudad. Desde 1894 ofrece a madrileños y turistas el tradicional chocolate con churros, además de refrescos, cafés y otro tipo de bollería. Se puede disfrutar de sus dulces tanto dentro del local como en la terraza exterior que recorre la calle peatonal. También cuentan con envío a domicilio.Decorada con castizas mesas de mármol blanco y un mostrador revestido de azulejería, la Chocolatería San Ginés ha sido nombrada en múltiples obras literarias como Los Episodios Nacionales, de Benito Pérez Galdós o Luces de Bohemia, de Valle Inclán.Su fama comenzó desde sus inicios, al ser el lugar frecuentado por el público tras salir del teatro para tomar un chocolate con churros y hoy puede presumir de haber sido premiada con los honores del Círculo de Lectores y del Ayuntamiento de Madrid como Centro Histórico Turístico. San Ginés cuenta, además, con otra sucursal en la calle López de Hoyos, 81, en el Mercado de Prosperidad, y en el extranjero está presente en Tokio, Shanghai y Bogotá.	40.416757700000	-3.706853100000	Clubs	Calle	de San Ginés	 5	28013
Delirio Dance Club	Local emblemático de Chueca abierto todo los días donde puedes encontrar un público diverso, gayfriendly y de todos los estilos. La fiesta aquí está asegurada.	40.424990585543	-3.696961104870	Clubs	Calle	Pelayo	 59	28004
Sala Milagros	Esta sala se ha especializado en teatro radiofónico por lo que cuidan especialmente el sonido con una amplia gama de micrófonos y también con una cúpula de sonido envolvente para los conciertos en directo, que hace que los espectadores sientan que están dentro de la banda de música.Desde La Sala Milagros buscan apoyar a los nuevos creadores produciendo espectáculos originales y novedosos. Aquí se quieren apoyar nuevas propuestas y ese es el empeño de esta sala que nace con el respaldo de THOLMA, la emisora de radio por internet Aire y también de una asociación de vecinos.	40.391716000000	-3.712334700000	Clubs	Calle	de la Inmaculada Concepción	 35	28019
Café del Jardín	El Museo del Romanticismo esconde, entre otras joyas, este remanso de paz que es el Café del Jardín. Se trata de un patio interior al aire libre protegido del calor del verano por paredes cubiertas de vegetación y parterres frondosos situados alrededor de una fuente. Se puede visitar libremente, sin pagar la entrada del museo.En este espacio tan agradable están situadas varias mesas y sillas que, junto con algunos bancos de madera, se convierten, cuando llega el buen tiempo, en un lugar perfecto para disfrutar de un té o un café con alguno de los exquisitos dulces o quiches saladas que se preparan en el local. Éste cuenta también con un salón cubierto con ventanas al jardín, igualmente agradable cuando el tiempo obliga a estar a cubierto.	40.425891033817	-3.698776960373	Clubs	Calle	de San Mateo	 13	28004
Santamaría. La coctelería de al lado	Situada en Malasaña, se trata de una antigua casa de citas reconvertida en coctelería al estilo clásico: barra larga de cuero negro (la misma que ya existía en el local), luces en campana verde, mueble bar en madera con detalles del rastro, moviliario vintage y retro mezclado con toques originales de diseño, suelo de madera sin tratar con detalles en pavimento decorativo.Entre sus paredes resuena música de gran calidad y hasta las 3:30 h en fin de semana, en un ambiente entre moderno y underground.	40.421303700000	-3.703413400000	Clubs	Calle	de la Ballesta	 6	28004
DRY Martini Bar by Javier de las Muelas	"Desde el interior del hotel Gran Melia Fénix, el barman Javier de las Muelas conquista la ciudad con una sucursal de su famosa coctelería barcelonesa, toda una referencia mundial en el arte de los cócteles. La estrella, aquí como en Barcelona, es el Dry Martini: vermú seco y ginebra, bien agitados en una coctelera con hielo y servidos en una copa triangular (copa martini) con un toque cítrico y una aceituna como adorno.El Dry Martini se compone de tres espacios diferenciados: el Tea Corner, bajo la cúpula de vidrio y con cómodos sillones y sofás; el Bar, con una barra de madera de 10 metros de longitud, en el que hay un contador de martinis servidos, gracias al cual el comensal puede disponer de un certificado firmado por Javier de las Muelas en el que se indica el número del martini tomado; y el salón ""Cuatro Estaciones"", con mesas, sillones y sofás, en el que una chimenea enmarcada por una librería rinde homenaje a la estancia de los Beatles, que estuvieron alojados en este hotel cuando actuaron en Madrid el 2 de junio de 1965.   "	40.426398423963	-3.689385205507	Clubs	Calle	de Hermosilla	 2	28001
La Libre	Situada en una antigua armería de la calle Argumosa, esta cafetería - librería ofrece a sus clientes la posibilidad de disfrutar de un café, un buen desayuno, un picoteo, una merienda o una copa a la par que leen alguno de los libros de segunda mano dejados por otros clientes para revender. El local está decorado con muebles de distintos estilos, papeles de colores, lámparas de diseño, con cierto toque propio de las décadas de 1960 y 1970.Cuenta con una interesante programación de talleres, presentaciones y música en directo.	40.407730685189	-3.696314692497	Clubs	Calle	Argumosa	 39	28012
La Cabra en el Tejado	Local situado en La Latina en el que poder picotear tapas francesas, orientales y españolas, desde hummus a tostas, crepes, y, por supuesto, disfrutar de unas cañas... En su interior se programan asiduamente exposiciones.	40.409299207333	-3.709570169449	Clubs	Calle	de Santa Ana	 29	28005
La Catrina Cantina Mezcalería	Situada en Malasaña, esta taberna mexicana cuenta con una cuidada decoración, con motivos del folclore mexicano y luces multicolor, y dispone de una gran variedad de cervezas mexicanas, así como de varios platos con los que poder disfrutar de la gastronomía de este país centroamericano. 	40.425255004144	-3.702062666416	Clubs	Calle	Corredera Alta de de San Pablo	 13	28004
Pelayo 58	Pelayo 58 es un club nocturno ubicado en el barrio de Chueca que se ha convertido en imprescindible de la noche madrileña. En su local es posible disfrutar de cervezas y cócteles a los mejores precios. Además, está disponible para la organización de eventos.	40.424082600000	-3.697512200000	Clubs	Calle	Pelayo	 58	28004
Terraza Café Prado	Sin descripcion	40.413810000000	-3.692524000000	Clubs	Calle	del Prado	 11	28014
El Palermo	Se trata de un local  mítico en Madrid en el que se puede tomar una copa y escuchar muy buena música. Al estar apartado del centro se evitan las aglomeraciones. Con una gran mesa de billar en el centro, una barra, y una puerta a la que hay que llamar se tiene la sensación de estar en posesión de un secreto cuando se entra. 	40.459209349143	-3.650298714638	Clubs	Calle	Palermo	 21	28043
Toni2	Creado en 1979, este piano bar permite escuchar música en directo de la mano de un pianista, pudiendo acompañarle cantando mientras se disfruta de una copa. Cuenta con una decoración de corte clásico, un gran piano de cola, y la presencia de un público heterogéneo. 	40.422607708485	-3.694716095924	Clubs	Calle	del Almirante	 9	28004
The Cask Whisky Bar	Se trata del bar pub del hotel Radisson. Situado en la zona del Paseo del Arte, toma el lujo y la elegancia del hotel y la animación del barrio.El bar es un espacio confortable en el que poder tomar una copa dentro de la selección de vinos españoles y cócteles de la más alta calidad que ofrece acompañados de algunas de las mejores tapas de la ciudad.	40.412590500000	-3.694098500000	Clubs	Calle	del Moratín	 52	28014
Taj Mahal	Es una coctelería con un ambiente relajado y tranquilo que ofrece música acogedora tipo chill out para charlar. A veces también se puede escuchar jazz, bossa, reggae o soul.Por la noche lo normal es escuchar algo más movido como house, minimal o trip op. Además, el local está amueblado con camas libanesas, sofás, pufs, sillones muy cómodos para que pasar la tarde o la noche sea agradable y no apetezca cambiar de sitio. Y lo consiguen.	40.458086400000	-3.677655100000	Clubs	Calle	Bolivia	 28	28016
Golden Gran Vía	La discoteca Golden es un club, sala de alquiler para fiestas y eventos y sala de conciertos al mismo tiempo. La característica del local es que se presenta para un público más maduro.Cuenta con orquesta en directo salvo los martes, y se divide en dos ambientes diferentes: uno rociero, y otro de música en directo de bailes de salón.	40.421366720875	-3.707288950682	Clubs	Calle	Gran Vía	 54	28013
Chocolatería Valor (Ibiza)	Sucursal de la popular chocolatería en el distrito de Retiro, cuyo producto estrella es el chocolate con churros, elaborado con los productos de la firma alicantina de chocolates Valor.El local, decorado con estilo clásico y sencillo, cuenta con varias mesas de mármol y sillas de madera. Dispone además de una zona destinada a la venta de bombones y otros productos de chocolate. Cuenta con un reservado y dispone de WiFi en todo el local.La carta ofrece una gran variedad de chocolates, helados, granizados y bollería diversa, así como café, zumos y batidos. Además, dispone del servicio take away para chocolate con churros. 	40.418315458193	-3.674234747887	Clubs	Calle	de Ibiza	 33	28009
Bears Bar	Bar de &#39;osos&#39; en el barrio de Chueca con una tradición ya tras sí. Uno de sus máximos éxitos es que en su local se celebra la famosa fiesta Mad Bear que se comenzó a celebrar en 2001 para fomentar el ambiente oso en Madrid.En el local, que acostumbra a sonar rock y música de los 80 y 90, organiza diferentes fiestas durante los fines de semana.	40.421902500000	-3.699038500000	Clubs	Calle	Pelayo	 4	28004
Enfrente Club	Hermano pequeño del buque insignia del movimiento &#39;oso&#39; madrileño, el Hot, del que se encuentra justo enfrente, de ahí su nombre. El local es más amplio que Hot, y cuenta con el dj residente Spunky como encargado de animar musicalmente cada sesión. 	40.420801607042	-3.700152933598	Clubs	Calle	de las Infantas	 12	28004
Suite Bar (Palacio del Retiro Autograph Collection)	Se trata del bar-cocteleria del exclusivo hotel Palacio del Retiro Autograph Collection, el mismo que ya existe en el hotel Santo Mauro. Como el hotel, este es un espacio de diseño, pequeño, exclusivo y muy chic. Un lugar para tomar la primera copa antes de salir de marcha por la zona de Retiro.Suite Bar se especializa en cócteles de diseño creados por maestros cocteleros como el cóctel By Alexander McQueen, una mezcla de whisky con jarabe de arándanos espolvoreada de polvos de oro de 24 quilates. La barra se convierte así en la pasarela de un desfile coctelero de alta costura.Los expertos barman del lugar han ideado una completa carta de cócteles a la altura en la que también entran en juego el champán (Royal Mumm, con G.H. Mumm), el vodka (Wybocosmo, revisión del cosmopolitan con Wyborowa Exquisite) o el ron (Royal Mojito, con Havana 15). El lujo es la seña distintiva de este bar, aunque un lujo austero y minimalista, cálido y tranquilo.	40.417780439200	-3.689228296280	Clubs	Calle	Alfonso XII	 14	28014
Picnic	En el corazón de Malasaña se encuentra, desde 2008, este acogedor café en el que la decoración está muy cuidada y donde, además de disfrutar de un café o una copa, se puede asistir a monólogos, actuaciones musicales y todo tipo de eventos culturales.El local se divide en dos plantas, una a pie de calle y otra en el sótano, en la que se desarrollan las actuaciones. Las mascotas son bienvenidas.	40.424238160904	-3.706277087331	Clubs	Calle	de las Minas	 1	28004
Café de la Luz	Cafetería en el céntrico barrio de Malasaña que ofrece un ambiente muy agradable con mobiliario ecléctico, sillas de distintas procedencias y decoración con un toque añejo.Aires vintage con colores crema y pastel. Ofrece tapas, cartas de cócteles, vinos, tartas, etc... Es un lugar para alargar la tarde, comenzar la noche o salir en plan tranquilo.	40.422059900000	-3.702512700000	Clubs	Calle	de la Puebla	 8	28004
DLRO Live	Local destinado al público gay y gay friendly, que se presenta como alternativa a las típicas salas de ambiente de Madrid. Tiene dos plantas de estilos totalmente diferenciados y se caracteriza por ofrecer espectáculos y eventos de gran relevancia.	40.424992627390	-3.696963787079	Clubs	Calle	Pelayo	 59	28004
Marta Cariño	Situado en pleno centro de Madrid, Marta Cariño se instala en el que fuera el mítico Larios Café, muy cerca de su predecesor, el Baila Cariño. Este espacio de 800 metros cuadrados divididos en dos plantas, esta organizado en cuatro zonas: restaurante, cocktail-bar, club, bombonera y terraza.El local, reformado en 2020, es un multiespacio de diseño en el que se puede comer o cenar en el restaurante y alargar la velada en su club disfrutando de buena música o en el cocktail bar probando alguno de sus estupendos cócteles. La carta del restaurante, de tipo mediterránea, se compone de entrantes, ensaladas, platos del mar, arroces, carnes y postres.La coctelería ofrece una gran variedad de combinados mezclados con bebidas espirituosas o sin alcohol, su cóctel especial es el llamado Marta Cariño compuesto por Ginebra Gordon’s Pink, licor de cacao blanco, zumo fresco de limón, sirope de frambuesa, clara de huevo y champagne brut.La planta baja acoge su club donde disfrutar de sesiones de dj´s o música en directo donde además se encuentra su bombonera, un espacio reservado para un grupo de 8 a 12 personas.	40.420622934111	-3.707740902901	Clubs	Calle	Silva	 4	28013
Bodeguita de Enmedio	En la Bodeguita de Enmedio celebran todo tipo de eventos a medida, desde cumpleaños y graduaciones a fiestas de empresa y cócteles temáticos.Situados en el distrito de Chamberí, se caracterizan por tener una amplia carta de bebidas con y sin alcohol, normales y premium.	40.439613000000	-3.694322000000	Clubs	Calle	de Fernández de la Hoz	 76	28003
Moondance	Situado justo detrás de la Puerta del Sol, en este local de cerca de 900 metros cuadrados se reúne lo más moderno y trendy de la capital cada fin de semana.Cuenta con una gran pista de baile y varias zonas para escuchar todo tipo de música. Ofrece diversión desde la medianoche hasta el amanecer.	40.418401900000	-3.701058200000	Clubs	Calle	de la Aduana	 21	28013
Diurno 	Situado en pleno barrio de Chueca, este amplio bar - restaurante (ocupa toda la planta baja del edificio) destaca por sus grandes ventanales que le otorgan luminosidad. En él se puede desde desayunar hasta tomar una copa de madrugada, todo ello en un local cosmopolita, punto de encuentro de vecinos, madrileños y turistas.El local, de estilo ecléctico e informal, se divide en tres ambientes únicos y diferentes.Su carta se compone de propuestas para compartir, principalmente, con platos que, además de un marcado carácter español, buscan una renovación con toques cosmopolitas e internacionales, creando platos más sofisticados y divertidos. Cuenta también con un completo brunch. 	40.421318224391	-3.697203844786	Clubs	Calle	de San Marcos	 37	28004
LASAL Bar Club	Todo un clásico en Madrid. Cuenta con un espacio grande, con dos plantas. La de arriba es más tranquila con música más baja y menos aglomeración de gente. La planta baja está más pensada para bailar y para albergar a más público. Entre semana ofrece conciertos en directo. Entre su clientela habitual se encuentran muchos estudiantes universitarios de los colegios mayores de la zona.	40.441578542279	-3.712477684021	Clubs	Calle	de Guzmán el Bueno	 98	28003
Dos Gardenias	Pequeño bar de luz tenue en el que la decoración está cuidada al milímetro. La música es muy agradable y se puede mantener una conversación sin necesidad de hacer verdaderos esfuerzos para escuchar al otro. Aquí se ofrece una gran variedad de tés, cafés, tartas… y por supuesto mojitos que son su especialidad. Se trata del sitio perfecto para pasar una tarde charlando.	40.413054934055	-3.697628974915	Clubs	Calle	Santa María	 13	28014
La 80	Local de ambiente lésbico en Lavapiés, aunque todo el mundo es bienvenido. Como su nombre advierte la música es de los 80: Freddy Mercury, Pet Shop Boys, Mecano, etc...	40.407522363092	-3.699637949467	Clubs	Calle	de la Sombrerería	 8	28012
La Habana Vieja	En este local del Paseo de Pintor Rosales se pueden encontrar piñas coladas, margaritas o daiquiris de calidad. También se pueden disfrutar las excelencias de una carta reducida pero contundente en la que no falta el tamal, los sandwiches cubanos y las delicias de atún, piña u otras delicatessen. 	40.429063945939	-3.721516728401	Clubs	Calle	de Pintor Rosales	 48	28008
Cervecería History	Situada a pocos metros de la Plaza de España, esta cervecería de estilo rockero divide su espacio en dos plantas, con diferentes estancias en cada una de ellas. Las consumiciones se sirven acompañadas de tapas. Disponen de una gran variedad de cervezas, copas, pero también cuentan con cafés y tés.	40.424258579594	-3.709368333221	Clubs	Calle	de los Reyes	 6	28015
El Naranja	El Naranja es un espacio de Malasaña en el que se puede cenar, tomar algo entre horas o por la noche disfrutar de una copa. También sirve de escenario para exposiciones, presentaciones, teatro, monólogos, espectáculos de magia. 	40.426127900000	-3.707585700000	Clubs	Calle	San Vicente Ferrer	 53	28015
