Nombre	Descripcion	Latitud	Longitud	Tipo	Clase_vial	Nombre_vial	Numero_vial	Codigo_postal
Sala Vesta	Instalada en el lugar que ocupaba uno de los clubs de jazz más prestigiosos de Madrid, el ya desparecido Bogui Jazz, se encuentra la Sala Vesta, un lugar que da cabida a todo tipo de sonidos y eventos.Desde conciertos de los grupos de música más consagrados hasta los más novedosos, sesiones de DJ o jam sesions, son algunas de las muchas actividades musicales de la agenda de esta sala que posee una estupenda acústica y un aforo de 174 personas. Pero no todo es música en Vesta, también tienen espacio para noches de micros abiertos, espectáculos de comedia, podcast con público en directo o noches canallas de cabaret y burlesque, entre otras nuevas experiencias e ideas.	40.422978800000	-3.695632800000	Clubs	Calle	del Barquillo	 29	28004
Casino Gran Madrid Torrelodones	A las afueras de la ciudad, en Torrelodones, el Gran Casino Madrid combina la atracción por el juego con el gusto por la gastronomía y los conciertos. Un espacio multidisciplinar con el azar como eje vertebrador.  Además de los juegos de azar, el casino cuenta con una sala de realidad virtual única en Europa, VRBlack, en la que se puede participar en varios juegos.Su oferta gastronómica es variada, compuesta por el restaurante Zero, donde se puede degustar una cocina tradicional, a la par que vanguardista, elaborada con productos de mercado de gran calidad; el restaurante Mandalay, elegante espacio de estilo vintage en el que se puede disfrutar de alta cocina internacional con espectáculo incluido; y el Cubik Gastro Market, un nuevo concepto de buffet donde deleitarse con platos sorprendentes ambientada con música en directo. 	40.565646800000	-3.913977500000	Clubs	Calle	Autovía A6 (Madrid-Coruña) salida 27	0	28250
Gran Casino Aranjuez	En el Gran Casino Aranjuez, además de al juego, le dedican un amplio espacio a la gastronomía y a la celebración de todo tipo de eventos, tanto públicos como privados, como bodas, comuniones o reuniones de empresa.El casino cuenta con mesas de poker, celebrándose a lo largo del año varios torneos, así como una zona destinada a la ruleta americana, al black jack, máquinas de azar, i-tables y apuestas deportivas. La oferta gastronómica se compone de un buffet, un restaurante donde poder degustar de una cena gourmet, un cóctel bar y un café teatro, inspirado en los cafés parisinos del siglo XIX.También dispone de una gran sala de espectáculos, con una capacidad para 2.000 personas, siendo capaz de albergar desde grandes musicales hasta las presentaciones más sencillas. Por su escenario han pasado artistas de la talla de Raphael, Miguel Bosé, Julio Iglesias, Marta Sánchez, David Bisbal, Isabel Pantoja, Joaquín Cortés, Sara Baras, Paloma San Basilio o Los del Río.	40.055614000000	-3.604527400000	Clubs	Calle	de la Unesco	 1	28300
Casino Gran Madrid Colón	Un espacio de más 4000 metros cuadrados distribuidos en cuatro plantas, dedicado al juego. La sucursal del mítico casino de Torrelodones dispone además del restaurante Mandarín, que propone un recorrido gastronómico con la cocina cantonesa y japonesa.Se han creado en el interior espacios exclusivos, atmósferas diferenciadas y una galería cromática que le da un aire sofisticado al casino. Aquí se puede jugar a las clásicas máquinas de azar, hay ruletas, black jack, póker de contrapartida y punto y banca.La oferta gastronómica se completa con el Rhum & Rhum Bar, con una extensa carta de cócteles y rones y la posibilidad de picar algo frío, y el Bond Bar, que ofrece una veintena de propuestas gastronómicas, cuidadas y ligeras, con platos eclécticos y complementarios a la oferta de Mandarin.	40.424491600000	-3.691445800000	Clubs	Calle	de Recoletos	 37 - 41	28004
Casino Gran Vía	En el corazón de la Gran Vía, se encuentra este casino situado en un lujoso edificio art decó construido entre 1919 y 1924, en el que estuvo la sede del Círculo Mercantil Industrial, declarado Patrimonio Artístico. El casino se divide en tres plantas dedicadas al juego donde se puede escoger entre ruletas francesas y americanas, mesas tradicionales de punto y banca, poker y black jack, así como una amplia e innovadora oferta de máquinas de azar y ruletas electrónicas.También cuenta con una amplia variedad de espacios de restauración, compuesta por el Restaurante Círculo Mercantil, el bar lounge La Cúpula, una coctelería y una amplia carta de snacks para tomar en la Sala de Juego.Además, también es posible reservar sus espacios para celebrar eventos privados o de empresa.	40.420115300000	-3.700814800000	Clubs	Calle	Gran Vía	 24	28013
Rockville Madrid	Esta sala de conciertos, situada muy cerca del Paseo de la Castellana, cuenta con un amplio programa de actuaciones musicales de todo tipo, en directo y a diario, en el que la calidad es el denominador común.El local, donde está cuidado hasta el más mínimo detalle, dispone de una amplia barra con taburetes y un banco corrido de madera en el que poder sentarse. Al fondo se sitúa el pequeño escenario en el que se puede disfrutar desde un concierto de pop-rock nacional, a un tributo a The Beatles, pasando por Jam Sessions, Jazz o música indie.Los fines de semana, a partir de la medianoche, tras finalizar el concierto, el local se transforma en un club en el que poder tomar una copa y bailar al ritmo de los éxitos actuales y temas clásicos.Además, Rockville ofrece su espacio para todo tipo de manifestaciones culturales, como exposiciones, presentaciones de libros, eventos o recitales.	40.453986300000	-3.694140200000	Clubs	Calle	de Brasil	 3	28020
Cien por Cien	Este legendario local situado en el distrito de Chamberí abrió sus puertas en 1985. En 1990 cambió de dueño y, desde entonces, se le conoce como un bar de copas en el que poder escuchar en directo la mejor música pop-rock e indie española.Por la sala han pasado importantes figuras de la escena musical española, como Antonio Vega, Loquillo, El Canto del Loco… Sus paredes están decoradas con las fotografías y recuerdos dejados por estos artistas.Reformado en 2019, el actual local cuenta con un mayor espacio para disfrutar la música en directo, ya que el Cien ofrece conciertos todos los días.   	40.437887693083	-3.700826168060	Clubs	Calle	de la Santísima Trinidad	 30	28010
Sácame por Dios	Los creadores del bar – restaurante Válgame Dios son los artífices de este karaoke y piano-bar de Chueca que, al igual que el anterior local, es frecuentado por varios artistas, entre ellos los actores y directores Los Javis, quienes lo han utilizado como uno de sus escenarios para la serie Paquita Salas, o los concursantes de las últimas ediciones de Operación Triunfo, entre otros. El local, que tiene una capacidad para 90 personas, abre todos los días menos los domingos. Entre semana suele haber, además, un día en el que cantantes y músicos noveles y semiprofesionales pueden actuar ante el público.En su decoración se alternan neones rosas con sofás y sillones de terciopelo en tonos pastel y algunos taburetes. Al fondo se sitúa el escenario, presidido por un piano que puede tocar todo aquél que se atreva.Para poder cantar alguno de los temas de su listado de canciones (desde éxitos de los 80 hasta la actualidad) es necesario realizar una consumición, aunque la entrada es gratuita. La selección de la canción se realiza a través de una tablet que es facilitada por los camareros.	40.423358100000	-3.699338000000	Clubs	Calle	de Hernán Cortés	 21	28004
El Lucero	Situado entre el Congreso de los Diputados y el Museo Nacional Thyssen-Bornemisza se encuentra este centro de flamenco y danza en el que, además de impartir cursos y talleres, también organizan espectáculos de flamenco los sábados por la tarde – noche.El centro ofrece clases de baile flamenco, cante flamenco, guitarra y cajón, así como danza española, sevillanas, ballet, danza contemporánea, cursos especiales para niños, yoga, pilates zumba y meditación chi-kung, entre otros.Todos los sábados, de 19:45 a 21:00 h ofrecen un espectáculo flamenco presentado por jóvenes artistas en el que se combina el flamenco de ayer y de hoy, dirigido al público en general. Durante el show se ofrece un aperitivo.El Lucero dispone también de seis salas totalmente equipadas e insonorizadas para realizar grabaciones musicales. 	40.416163300000	-3.695448900000	Clubs	Calle	del Marqués de Cubas	 25	28014
Bam Karaoke Box	Situado en pleno Paseo de Recoletos, el local está inspirado en el concepto del karaoke box asiático y cuenta ya con varias sucursales en París y Burdeos. Esta idea fundada por Arnaud Studer en Francia, en el año 2014, llega a Madrid con un karaoke privado de alta gama en el que poder disfrutar con amigos o familia cantando alguno de los 20 000 temas que componen su catálogo, mientras se degusta sus cócteles exclusivos y tapas.El espacio dispone de siete salas privadas tematizadas, con capacidad desde 4 a 12 personas y una elegante coctelería. Todas ellas cuentan con un equipo de calidad, con altavoces de la marca Bose y micrófonos de la marca Shure. En cada una de ellas se puede acondicionar el ambiente, pudiéndose elegir la intensidad de los colores y la iluminación, así como el volumen de la música.	40.421582400000	-3.688928600000	Clubs	Calle	de Recoletos	 23	28001
Blackhaus	Este exclusivo y elegante local de ocio nocturno destaca por ser un espacio multifuncional y versátil, compuesto por una discoteca con distintos ambientes y salas de diseño, restaurante y coctelería, varias terrazas y un amplio parking de 14 000 m2, con servicio de aparcacoches. Dada su disposición, es un lugar perfecto para eventos corporativos y celebraciones.En la Main Room se celebran distintas sesiones de miércoles a domingo. En su restaurante se puede disfrutar de una propuesta gastronómica de alta cocina, opciones saludables, sushi y postres sin gluten, desde el 15 de mayo al 31 de octubre. En verano, su terraza es una de las mejores opciones para vivir la noche madrileña.	40.461347600000	-3.766332700000	Clubs	Calle	de la Coruña	 km 8.700	28023
Panda Club Madrid	Situada junto a Nuevos Ministerios y el Paseo de la Castellana, esta sala de referencia de la noche madrileña cuenta con sesiones con una gran variedad musical, desde el reggaeton al techno house, pasando por la música electrónica y más comercial del momento, de la mano de djs reconocidos, como Alexander Som, Luiggi Nieto y KPD, entre otros.Panda Club dispone también de un restaurante en el que se puede disfrutar de una carta mediterránea con toques asiáticos. A mitad de la noche, además, hay un servicio gratuito de comida para los clientes.La discoteca se divide en dos zonas con distintos estilos musicales, reservados situados a ambos lados de la pista central y reservados V.I.P, junto a la cabina del DJ. Para eventos privados disponen de un espacio exclusivo independiente del resto de la sala.La decoración es de inspiración underground, aunque elegante y sofisticada como un club londinense. Se exige un código de vestimenta para poder entrar.	40.448151900000	-3.695981400000	Clubs	Calle	de Hernani	 75	28020
Bling Bling	Justo al lado del Museo de Cera se encuentra esta sofisticada discoteca, que ya cuenta con otro exitoso local en Barcelona, en la que se puede disfrutar del ocio nocturno de alto standing. Su responsable es el grupo Costa Este, artífices de Opium Madrid, otro de los clubes más destacados de la noche madrileña.El local, situado donde antes estuvo el club HOT, cuenta con dos plantas y se divide en tres ambientes musicales diferenciados: reggaetón, house y éxitos de radiofórmula. A lo largo de la semana se desarrollan fiestas temáticas.	40.425360400000	-3.691774400000	Clubs	Calle	de Génova	 28	28004
Hangar 48	En plena calle de Bailén, en el Barrio de la Latina y próximo a Las Vistillas, se encuentra esta sala de grandes dimensiones que combina música en directo, arte y performance bajo el mismo techo.En Hangar 48 se dan cita bandas emergentes y grupos consagrados. Al ser un espacio versátil, se pueden crear espectáculos a medida. De madrugada, el equipo de DJ&#39;s pincha grandes éxitos de todos los tiempos.	40.411396300000	-3.714041100000	Clubs	Calle	de Bailén	 24	28005
Blackbird Rock Bar	Situado en el Barrio de las Letras, este bar de copas ofrece música en directo todos los días de la semana, desde rock & roll al country, pasando por el blues, el soul y el pop –rock.El local dispone de varias mesas para poder tomar algo sentado mientras se disfruta del concierto. Los colores negro y rojo predominan en su decoración, con las paredes vestidas con múltiples fotografías de reconocidos artistas internacionales así como instrumentos musicales.Entre los artistas que han actuado en su escenario se encuentran Edu Manazas, Greg Izor, Lele Laina, Miguel Oñate, Chino Banzai, Leonor Marchesi, Mercedes Ferrer, Pablo Martín, Armando de Castro, Julián Kanevsky, Gabi Boente, David Salvador y Pedro Girón.	40.413687000000	-3.699630000000	Clubs	Calle	de las Huertas	 22	28014
Tacones Manoli	CERRADO AL PÚBLICO HASTA NUEVO AVISO PARA LA CONTENCIÓN DE LA TRANSMISIÓN DEL CORONAVIRUS.Tacones Manoli participa en el espacio al aire libre Abre Madrid, en Feria de Madrid - Ifema, viernes y sábados desde el 17 de julio, junto a Uñas Chung Lee y Medias Puri.La productora LetsGo, promotora de Medias Puri y Uñas Chung Lee, es la artífice de este espectáculo clandestino inmersivo, que se inspira en experiencias teatrales internacionales que triunfan en el resto del mundo, adaptándolo a su propio universo. Se trata de un viaje al universo lorquiano con toques flamencos, que combina baile, canto, música y teatro gestual, en el que el espectador también cuenta con su papel.Tacones Manoli se ubica en un antiguo palacio de la calle de la Bolsa, en pleno centro de Madrid. El público, ataviado con una máscara, recorre libremente sus tres plantas, compuestas por varias estancias y escenas diferentes protagonizadas por personajes inspirados en la obra La casa de Bernarda Alba, de Federico García Lorca. Cada persona puede tener, de esta manera, su propia experiencia.El espectáculo tiene una duración de unas dos horas, aproximadamente, y durante su desarrollo se servirá comida y bebida a los espectadores.Detrás de este proyecto se encuentra un equipo creativo formado por Felype de Lima, responsable de la dirección artística, escenografía y vestuario (Premio Max 2015 al Mejor Diseño de Vestuario) y Manuel Liñán, coreógrafo de reconocido prestigio que ha sido distinguido con varios galardones, entre los que destaca el Premio Nacional de Danza 2017. 	40.415105600000	-3.705021000000	Clubs	Calle	de la Bolsa	 12	28012
Uñas Chung Lee	CERRADO AL PÚBLICO HASTA NUEVO AVISO PARA LA CONTENCIÓN DE LA TRANSMISIÓN DEL CORONAVIRUS.Uñas Chung Lee participa en el espacio al aire libre Abre Madrid, en Feria de Madrid - Ifema, viernes y sábados desde el 17 de julio, junto a Medias Puri y Tacones Manoli.De la mano de la productora y promotora de espectáculos LetsGo Company, artífice de la saga The Hole y del local de moda Medias Puri, este espacio de ocio nocturno, que repite la fórmula de club pseudoclandestino, ofrece la posibilidad de vivir una experiencia alocada y divertida gracias a sus espectáculos inspirados en el lejano oriente, a su variada propuesta musical y a su estética asiática - futurista.Nada más entrar en Uñas Chung Lee el visitante se encuentra con un local de manicura al uso, donde, efectivamente, se pueden hacer las uñas en su nail spa. Hacia el fondo se encuentra el acceso a la discoteca, en la que se puede bailar al ritmo de los grandes éxitos musicales de ayer y de hoy, disfrutar de las acrobacias y coreografías de sus bailarines y actores e, incluso, demostrar las dotes de cantante en un karaoke coreano.	40.436191600000	-3.716261000000	Clubs	Calle	Hilarión Eslava	 38	28015
Lola 09	Donde antes estuvo el restaurante Olé Lola ahora se encuentra este local que, bajo la misma dirección, ha dado un cambio radical a su oferta y estética, convirtiéndose en un espacio cosmopolita, moderno y desenfadado, donde se puede disfrutar de una variada coctelería así como de una oferta gastronómica en forma de raciones y algunos platos más elaborados.Lola 09 se define como tasca chill, un espacio polivalente donde disfrutar de la cocina española con un toque de autor, a la par que de un cóctel o una copa, así como de buena música. Además, todos los meses se organizan sesiones de intercambio de idiomas, los jueves se programan sesiones musicales con todo tipo de ritmosEl chef Gabriel Cabestany es el encargado de una carta que bebe de los sabores y aromas de distintas parte del mundo. El barman Carlos Vega ofrece una interesante variedad de cócteles y tragos Premium. 	40.425982915616	-3.698084950447	Clubs	Calle	de San Mateo	 28	28004
Barehuä	Próximo a la Plaza de Santa Ana, en el corazón del Barrio de las Letras, este pequeño local fundado por la venezolana Patricia Gonzalo presenta un concepto de restauración que combina alimentos extranjeros con productos nacionales, consiguiendo una fusión de sabores venezolanos y franceses.Barehuä permite disfrutar de la pastelería francesa combinada con ingredientes como la parchita o la guayaba, o saborear sándwiches con pernil de cochino con pimiento de piquillo o croquetas de jojoto. Entre semana, de martes a viernes, disponen de menú del día.El local cuenta con varias mesas en el interior y una pequeña terraza.	40.413258600000	-3.699071900000	Clubs	Calle	del Leon	 23	28014
Lucky Dragon	En el lugar en el que estuvo El Fabuloso, de Silvia Superstar, se encuentra este local nocturno de Malasaña, regentado también por la artista. Decoración impactante, música divertida y un karaoke con canciones en chino y castellano son algunas de sus principales bazas para destacar entre el ocio nocturno madrileño.El local está inspirado en un callejón de Chinatown, con farolillos chinos, neones y muchos dragones en su planta principal. En la planta inferior la decoración recuerda a los clubs privados de Beijing, con telas de Damasco doradas y murales que recuerdan el Imperio Mandarín, en la que se encuentra el karaoke. En ambas plantas hay mesa de Dj.La música que se suele pinchar son temas disco, salsa, italo-disco, y house.	40.421911000000	-3.705841200000	Clubs	Calle	Estrella	 2	28004
Sweet Dreams El Viso	El barrio de El Viso, en Chamartín, acoge este bar de copas en el que se celebran actuaciones musicales en directo y divertidas sesiones de DJ’s, aderezadas con productos de calidad.El local se divide en dos plantas que están decoradas de manera elegante y con clase, pero con el toque gamberro de los años 80. Cada detalle está cuidado al máximo, fusionando el diseño más innovador con la comodidad.Sweet Dreams El Viso también es una buena opción como afterwork, para comenzar la fiesta desde por la tarde y enlazar con las noches, así como para celebrar eventos privados.	40.446187900000	-3.686556500000	Clubs	Calle	de Joaquín Costa	 27	28002
Terraza Hotel Emperador	Situada en la décima planta del Hotel Emperador, desde esta terraza se consigue una perspectiva inigualable de la Gran Vía madrileña. Renovada por el arquitecto Nacho García de Vinuesa, este espacio abre durante todo el año, ya que cuenta con zonas climatizadas y acondicionadas para el frío y la lluvia.Durante la temporada de primavera – verano, se convierte en un elegante beach club durante el día, gracias a su gran piscina, que data de 1948. La propuesta gastronómica corre a cargo de su restaurante snack bar, compuesta de platos frescos y veraniegos. Abierta al público en general, con el precio de la entrada se incluye 1 toalla, una tumbona y una copa.Por las tardes, se convierte en un cóctel bar de autor desde el que poder disfrutar de los mejores atardeceres de Madrid con un combinado elaborado por el barman internacional Luca Anastasio.El hotel Emperador ofrece, además, una visita guiada en la terraza todos los miércoles (previa reserva), en la que un guía oficial explica a los visitantes los lugares más emblemáticos que se divisan desde la azotea, así como la particular historia del hotel y el espacio sobre el que se eleva en la Gran Vía.	40.421403986570	-3.708128482103	Clubs	Calle	Gran Vía	 53	28013
La Virgen 154	La unión de Cervezas La Virgen y Kitchen 154 ha dado como resultado este establecimiento en el que se puede disfrutar de cerveza artesanal y de cocina asiática callejera en el corazón de Chamberí, muy cerca de la popular calle Ponzano, conocida por la variedad y calidad de sus restaurantes.Situado en lo que fue un garaje, el local cuenta con una gran barra, la cocina vista y con 4 grandes mesas corridas con un aforo próximo a los 100 comensales, semejante a los grandes cafés de Malasia y Singapur.La carta incluye platos sorprendentes a buen precio, de entre los que destacan las costillas coreanas y los siao mai, dumplings chinos en versión malaya.	40.438697100000	-3.700979600000	Clubs	Calle	de José Abascal	 11	28003
Sala 0 (Palacio de la Prensa)	Situada en el local donde se encontraba la discoteca Bash, en los bajos de los cines Palacio de la Prensa, la Sala 0 se ha convertido en uno de los espacios madrileños de referencia de la música en vivo, gracias a su participación en el proyecto SON ESTRELLA GALICIA, que apuesta por la música independiente, con estilos tan diversos como el pop, el rock o la electrónica.La sala, que cuenta con un aforo para 390 personas, acoge también diferentes sesiones de DJ’s.	40.420534400000	-3.705843500000	Clubs	Calle	Gran Vía	 46	28013
La cueva de Lola	Este restaurante, situado a pocos metros de la calle Bailén y Las Vistillas, en pleno corazón de La Latina, ofrece un espectáculo flamenco de más de una hora de duración, con cante, baile y guitarra interpretado por un gran elenco de artistas consagrados dentro y fuera de España. Dispone de un menú de cena compuesto por entrantes, plato principal, postre y bebida, que se degusta antes del espectáculo. También se puede asistir directamente al show con una bebida incluida en la entrada.	40.412113500000	-3.711784400000	Clubs	Calle	de los Mancebos	 2	28005
Oh My Club	Enmarcado en el distrito de Tetuán, muy cerca del Paseo de la Castellana y de la zona financiera de Madrid, este local ofrece la posibilidad de disfrutar del ocio nocturno madrileño desde la cena hasta las últimas copas de la madrugada, todo ello aderezado con una interesante propuesta gastronómica y espectáculos musicales.Oh My Club dispone de 1.250 metros cuadrados, presentados como un jardín invertido que integra la última tecnología, realidad virtual y un techo topográfico con efecto de olas.La carta, elaborada por el chef Jorge Baeza, mezcla las mejores recetas de la cocina mediterránea con los platos de tradición oriental.	40.462761000000	-3.692955000000	Clubs	Calle	de Rosario Pino	 14	28020
Estupenda Café Bar	El barrio de Malasaña acoge este curioso local cuya decoración está basada en la famosa serie de televisión de David Lynch, Twin Peaks. Silvia Superstar, cantante del grupo Killer Barbies, renueva su antiguo local, el Coconut Bar, y lo convierte en Estupenda Café Bar. Este lugar ofrece la posibilidad de saborear tartas caseras, perritos calientes, batidos o cócteles a diario, desde el mediodía hasta la madrugada. También cuentan con sesiones de Dj’s, sesiones de cine y monólogos.El local se divide en dos plantas. La primera recrea el Double R Diner, el café de la famosa serie de televisión, desde la indumentaria de las camareras hasta el más mínimo detalle está plasmado en su decoración. La planta inferior, está inspirada en la Red Room, con luces rojas y cortinas aterciopeladas y el escenario Roadhouse, donde hay hasta un pequeño altar dedicado a Laura Palmer.La carta recuerda también los platos presentes en Twin Peaks, con sus tartas caseras, como la famosa cherry pie.	40.422639500000	-3.704583800000	Clubs	Calle	de San Roque	 14	28004
Catarsis	De la mano del grupo Larrumba y liderada por los bartenders Carlos Moreno y Raquel Espolio, esta coctelería situada en la popular calle Ponzano, conocida por su gran oferta de restauración, ofrece una carta con más de 25 cócteles, con clásicos de Larrumba como Burbujas de Pasión, Recuerdos del Pasado o Mi cuerpo pide salsa y nuevas incorporaciones como El Baúl de Pancho Villa, Carlos Llévame en tu Bicicleta o La Vuelta Al Mundo en un Gin Fizz.	40.437770300000	-3.699213700000	Clubs	Calle	de Ponzano	 14	28010
Misericordia The Club	En los bajos de la Taberna Bandido, en el corazón del Paseo del Arte, se encuentra este local clandestino al que se accede a través de un acceso secreto, gracias a una de las 200 llaves disponibles. En él se puede disfrutar de música pinchada por un dj mientras se toma una copa.El local ha sido decorado por Inés Benavides, al igual que la Taberna Bandido. Su interiorismo recuerda a los speakeasy berlineses o neoyorquinos, así como también cuenta con motivos propios de la movida madrileña.	40.421960000000	-3.690007800000	Clubs	Calle	del Cid	 1	28001
La Cúpula de Florida Retiro	Situado en la mítica sala de fiestas Florida Retiro, este espacio es una zona de copas en la que se puede disfrutar de los selectos cócteles diseñados por el bartender Miguel Angel Jiménez. Abre los viernes y sábados desde las 22:00 h hasta las 5 de la madrugada.La Cúpula dispone de espacios privados, mesas VIP y música española, todo ello en un entorno agradable.Florida Retiro es un moderno multiespacio dedicado al ocio y la restauración, del que son especialmente conocidas sus cenas con espectáculo.	40.418086748305	-3.680098056793	Clubs	Calle	de Panamá s/n	0	28009
